html_url;description;project;language;organisation;research_group
https://github.com/Open-Systems-Pharmacology/Erythromycin-Triazolam-DDI;;research;;startup;open_systems_pharmacology
https://github.com/Open-Systems-Pharmacology/Clarithromycin-Triazolam-DDI;Modeling of published clinical Clarithromycin-Triazolam-DDI studies for model evaluation ;research;;startup;open_systems_pharmacology
https://github.com/Open-Systems-Pharmacology/Fluvoxamine-Alprazolam-DDI;;research;;startup;open_systems_pharmacology
https://github.com/Open-Systems-Pharmacology/Nicotine-Cotinine-Model;Whole-body PBPK/PD model of nicotine and cotinine;research;;startup;open_systems_pharmacology
https://github.com/Open-Systems-Pharmacology/Rifampicin-Alprazolam-DDI;Modeling of published clinical Rifampicin-Alprazolam-DDI studies for model evaluation ;research;;startup;open_systems_pharmacology
https://github.com/Open-Systems-Pharmacology/Rifampicin-Triazolam-DDI;Modeling of published clinical Rifampicin-Triazolam-DDI studies for model evaluation ;research;;startup;open_systems_pharmacology
https://github.com/Open-Systems-Pharmacology/Efavirenz-Model;Whole-body PBPK model of efavirenz as CYP3A4 perpetrator drug ;research;MATLAB;startup;open_systems_pharmacology
https://github.com/Open-Systems-Pharmacology/Efavirenz-Midazolam-DDI;Modeling of published clinical Efavirenz-Midazolam-DDI studies for model evaluation ;research;;startup;open_systems_pharmacology
https://github.com/Open-Systems-Pharmacology/Efavirenz-Alfentanil-DDI;Modeling of published clinical Efavirenz-Alfentanil-DDI studies for model evaluation;research;;startup;open_systems_pharmacology
https://github.com/Open-Systems-Pharmacology/OSP-Qualification-Reports;Qualification Reports recreated with every new OSP Release;research;;startup;open_systems_pharmacology
https://github.com/Open-Systems-Pharmacology/OSP-PBPK-Model-Library;Library of released PBPK substance models and evaluation reports;research;MATLAB;startup;open_systems_pharmacology
https://github.com/Open-Systems-Pharmacology/Erythromycin-Model;;research;MATLAB;startup;open_systems_pharmacology
https://github.com/Open-Systems-Pharmacology/Verapamil-Midazolam-DDI;Modeling of published clinical Verapamil-Midazolam-DDI studies for model evaluation;research;;startup;open_systems_pharmacology
https://github.com/Open-Systems-Pharmacology/Verapamil-Model;Verapamil PBPK model (parent only);research;MATLAB;startup;open_systems_pharmacology
https://github.com/Open-Systems-Pharmacology/Metformin-Model;Whole-body PBPK model of metformin (OCT2/MATE DDI victim drug);research;;startup;open_systems_pharmacology
https://github.com/Open-Systems-Pharmacology/Cimetidine-Metformin-DDI;Modeling of published clinical Cimetidine-Metformin-DDI studies for model evaluation;research;;startup;open_systems_pharmacology
https://github.com/Open-Systems-Pharmacology/Cimetidine-Midazolam-DDI;Modeling of published clinical Cimetidine-Midazolam-DDI studies for model evaluation;research;;startup;open_systems_pharmacology
https://github.com/Open-Systems-Pharmacology/Cimetidine-Model;Whole-body PBPK model of cimetidine (OCT2/MATE and CYP3A4 DDI perpetrator drug);research;MATLAB;startup;open_systems_pharmacology
https://github.com/Open-Systems-Pharmacology/Incretins-Model;Physiologically-based Quantitative Systems Pharmacology model of GLP-1 and GIP and DPP4-inhibitor sitagliptin;research;R;startup;open_systems_pharmacology
https://github.com/Open-Systems-Pharmacology/OSPSuite.CPP-Toolbox;;no_research;C;startup;open_systems_pharmacology
https://github.com/Open-Systems-Pharmacology/PharMetrX-Workshop-June-2020;Training materials for the PharMetrX OSP PBPK workshop, online, June 2020;no_research;;startup;open_systems_pharmacology
https://github.com/Open-Systems-Pharmacology/Buprenorphine-Model;Whole-body PBPK models of buprenorphine for adults, children and preterm neonates;research;;startup;open_systems_pharmacology
https://github.com/Open-Systems-Pharmacology/CompiledModel-Template;;no_research;C++;startup;open_systems_pharmacology
https://github.com/Open-Systems-Pharmacology/Amoxicillin-Model;Whole-body PBPK model of intravenously administered amoxicillin for adults, pregnant women and postpartum women;research;;startup;open_systems_pharmacology
https://github.com/Open-Systems-Pharmacology/Fentanyl-Model;Physiologically-Based Pharmacokinetic (PBPK) Modeling of Fentanyl in Adults and Pediatric Patients;research;;startup;open_systems_pharmacology
https://github.com/Open-Systems-Pharmacology/Lung-absorption-model;Pulmonary drug absorption implemented in MoBi (Eriksson et al. 2020);research;;startup;open_systems_pharmacology
https://github.com/Open-Systems-Pharmacology/Roadmap;Roadmap for the Open Systems Pharmacology Platform;no_research;;startup;open_systems_pharmacology
https://github.com/Open-Systems-Pharmacology/Trimethoprim-Model;;research;;startup;open_systems_pharmacology
https://github.com/Open-Systems-Pharmacology/Trimethoprim-Metformin-DDI;;research;;startup;open_systems_pharmacology
https://github.com/Open-Systems-Pharmacology/Trimethoprim-Repaglinide-DDI;;research;;startup;open_systems_pharmacology
https://github.com/Open-Systems-Pharmacology/Trimethoprim-Pioglitazone-DDI;;research;;startup;open_systems_pharmacology
https://github.com/Open-Systems-Pharmacology/Rifampicin-Trimethoprim-DDI;;research;;startup;open_systems_pharmacology
https://github.com/Open-Systems-Pharmacology/Levonorgestrel;Whole-body PBPK model of levonorgestrel with and without ethinyl estradiol as CYP3A4 DDI victim drug;research;;startup;open_systems_pharmacology
https://github.com/Open-Systems-Pharmacology/Cimetidine-Verapamil-DDI;Modeling of published clinical Cimetidine-Verapamil-DDI studies for model evaluation ;research;;startup;open_systems_pharmacology
https://github.com/Open-Systems-Pharmacology/Cimetidine-Alprazolam-DDI;Modeling of published clinical Cimetidine-Alprazolam-DDI studies for model evaluation ;research;;startup;open_systems_pharmacology
https://github.com/Open-Systems-Pharmacology/Cimetidine-Triazolam-DDI;Modeling of published clinical Cimetidine-Triazolam-DDI studies for model evaluation ;research;;startup;open_systems_pharmacology
https://github.com/Open-Systems-Pharmacology/Cimetidine-Alfentanil-DDI;Modeling of published clinical Cimetidine-Alfentanil-DDI studies for model evaluation;research;;startup;open_systems_pharmacology
https://github.com/Open-Systems-Pharmacology/Furosemide-Model;Whole-body PBPK model of furosemide (OAT victim drug) ;research;;startup;open_systems_pharmacology
https://github.com/Open-Systems-Pharmacology/Probenecid-Model;Whole-body PBPK model of probenecid (OAT perpetrator drug);research;;startup;open_systems_pharmacology
https://github.com/Open-Systems-Pharmacology/Probenecid-Furosemide-DDI;Modeling of published clinical Probenecid-Furosemide-DDI studies for model evaluation ;research;;startup;open_systems_pharmacology
https://github.com/Open-Systems-Pharmacology/Probenecid-Rifampicin-DDI;Modeling of published clinical Probenecid-Rifampicin-DDI studies for model evaluation ;research;;startup;open_systems_pharmacology
https://github.com/Open-Systems-Pharmacology/Rifampicin-Verapamil-DDI;Modeling of published clinical Rifampicin-Verapamil-DDI studies for model evaluation;research;;startup;open_systems_pharmacology
https://github.com/Open-Systems-Pharmacology/BE-Studies;;no_research;;startup;open_systems_pharmacology
https://github.com/Open-Systems-Pharmacology/Ethinylestradiol-Model;Whole-body PBPK model of ethinylestradiol as CYP1A2 DDI perpetrator drug;research;MATLAB;startup;open_systems_pharmacology
https://github.com/Open-Systems-Pharmacology/Mexiletine-Model;Whole-body PBPK model of mexiletine as CYP1A2 DDI substrate and inhibitor drug;research;MATLAB;startup;open_systems_pharmacology
https://github.com/Open-Systems-Pharmacology/Moclobemide-Model;Whole-body PBPK model of moclobemide as  a substrate and a moderate inhibitor of CYP2C19;research;MATLAB;startup;open_systems_pharmacology
https://github.com/Open-Systems-Pharmacology/Omeprazole-Model;Whole-body PBPK model of omeprazole as a substrate of CYP2C19 and CYP3A4 and an inhibitor of CYP2C19.;research;MATLAB;startup;open_systems_pharmacology
https://github.com/Open-Systems-Pharmacology/S-Mephenytoin-Model;Whole-body PBPK model of s-mephenytoin as a substrate of CYP2C19;research;MATLAB;startup;open_systems_pharmacology
https://github.com/Open-Systems-Pharmacology/Tizanidine-Model;Whole-body PBPK model of tizanidine as a substrate of CYP1A2;research;MATLAB;startup;open_systems_pharmacology
https://github.com/Open-Systems-Pharmacology/Metoprolol-Model;PBPK model of metoprolol and metoprolol-CYP2D6 drug-gene interactions;research;;startup;open_systems_pharmacology
https://github.com/Open-Systems-Pharmacology/Ethinylestradiol-Caffeine-DDI;Modeling of published clinical Ethinylestradiol-Caffeine-DDI studies for model evaluation.;research;;startup;open_systems_pharmacology
https://github.com/Open-Systems-Pharmacology/Mexiletine-Caffeine-DDI;Modeling of published clinical Mexiletine-Caffeine-DDI studies for model evaluation;research;;startup;open_systems_pharmacology
https://github.com/Open-Systems-Pharmacology/Fluvoxamine-Mexiletine-DDI;Modeling of published clinical Fluvoxamine-Mexiletine-DDI studies for model evaluation;research;;startup;open_systems_pharmacology
https://github.com/Open-Systems-Pharmacology/Ethinylestradiol-Tizanidine-DDI;Modeling of published clinical Ethinylestradiol-Tizanidine-DDI studies for model evaluation;research;;startup;open_systems_pharmacology
https://github.com/Open-Systems-Pharmacology/Fluvoxamine-Tizanidine-DDI;Modeling of published clinical Fluvoxamine-Tizanidine-DDI studies for model evaluation;research;;startup;open_systems_pharmacology
https://github.com/Open-Systems-Pharmacology/Mexiletine-Tizanidine-DDI;Modeling of published clinical Mexiletine-Tizanidine-DDI studies for model evaluation;research;;startup;open_systems_pharmacology
https://github.com/Open-Systems-Pharmacology/Fluvoxamine-Omeprazole-DDI;Modeling of published clinical Fluvoxamine-Omeprazole-DDI studies for model evaluation;research;;startup;open_systems_pharmacology
https://github.com/Open-Systems-Pharmacology/Moclobemide-Omeprazole-DDI;Modeling of published clinical Moclobemide-Omeprazole-DDI studies for model evaluation;research;;startup;open_systems_pharmacology
https://github.com/Open-Systems-Pharmacology/Fluvoxamine-S-mephenytoin-DDI;Modeling of published clinical Fluvoxamine-S-mephenytoin-DDI studies for model evaluation;research;;startup;open_systems_pharmacology
https://github.com/Open-Systems-Pharmacology/Qualification-DDI-CYP1A2;Qualification of OSP platform for CYP1A2-mediated DDI;research;MATLAB;startup;open_systems_pharmacology
https://github.com/Open-Systems-Pharmacology/Qualification-DDI-CYP2C19;Qualification of OSP platform for CYP2C19-mediated DDI;research;MATLAB;startup;open_systems_pharmacology
https://github.com/Open-Systems-Pharmacology/Inhalation-model;Implementation of inhalation model in MoBi;research;R;startup;open_systems_pharmacology
https://github.com/Open-Systems-Pharmacology/OSPSuite-Epics;Repository used to define epics for our releases;no_research;;startup;open_systems_pharmacology
https://github.com/Open-Systems-Pharmacology/Quetiapine-Model;;research;;startup;open_systems_pharmacology
https://github.com/Open-Systems-Pharmacology/Aripiprazole-Model;;research;;startup;open_systems_pharmacology
https://github.com/Open-Systems-Pharmacology/Bupropion-Model;;research;;startup;open_systems_pharmacology
https://github.com/Open-Systems-Pharmacology/Rifampicin-Bupropion-DDI;;research;;startup;open_systems_pharmacology
https://github.com/Open-Systems-Pharmacology/Fluvoxamine-Voriconazole-Bupropion-DDI;;research;;startup;open_systems_pharmacology
https://github.com/Open-Systems-Pharmacology/PharMetrX-Workshop-April-2021;Training materials for the PharMetrX OSP PBPK workshop, online, April 2021;no_research;;startup;open_systems_pharmacology
https://github.com/Open-Systems-Pharmacology/Carbamazepine-Model;PBPK model of carbamazepine as CYP3A4 and CYP2B6 substrate and inducer;research;MATLAB;startup;open_systems_pharmacology
https://github.com/Open-Systems-Pharmacology/Carbamazepine-Alprazolam-DDI;Modeling of published clinical Carbamazepine-Alprazolam-DDI studies for model evaluation;research;;startup;open_systems_pharmacology
https://github.com/Open-Systems-Pharmacology/Carbamazepine-Bupropion-DDI;Modeling of published clinical Carbamazepine-Bupropion-DDI studies for model evaluation;research;;startup;open_systems_pharmacology
https://github.com/Open-Systems-Pharmacology/Erythromycin-Carbamazepine-DDI;Modeling of published clinical Erythromycin-Carbamazepine DDI studies for model evaluation;research;;startup;open_systems_pharmacology
https://github.com/Open-Systems-Pharmacology/Carbamazepine-Efavirenz-DDI;Modeling of published clinical Carbamazepine-Efavirenz DDI studies for model evaluation;research;;startup;open_systems_pharmacology
https://github.com/Open-Systems-Pharmacology/FDA-OSP-workshop-April-2021;;no_research;;startup;open_systems_pharmacology
https://github.com/Open-Systems-Pharmacology/Irinotecan-Model;Whole-body PBPK model of Irinotecan (CPT-11) & SN-38 determining tumor tissue kinetics of both parent drug & active metabolite.;no_research;;startup;open_systems_pharmacology
https://github.com/Open-Systems-Pharmacology/IVIVC-with-particle-dissolution-module-in-OSP;;research;R;startup;open_systems_pharmacology
https://github.com/Open-Systems-Pharmacology/OSPSuite.ParameterIdentification;R package for parameter identification for OSPS models;research;R;startup;open_systems_pharmacology
https://github.com/Open-Systems-Pharmacology/Cabozantinib-Model;Cabozantinib PBPK;research;;startup;open_systems_pharmacology
https://github.com/Open-Systems-Pharmacology/Docker-Base-Images;;no_research;Shell;startup;open_systems_pharmacology
https://github.com/Open-Systems-Pharmacology/Docker-Images;Temporary solution - images are created manually. Later docker images should be created automatically as part of CI;no_research;Shell;startup;open_systems_pharmacology
https://github.com/Open-Systems-Pharmacology/Docker-Images-Ospsuite-R;Temporary solution - images are created manually. Later docker images should be created automatically as part of CI;no_research;Shell;startup;open_systems_pharmacology
https://github.com/Open-Systems-Pharmacology/Docker-Images-ReportingEngine;Temporary solution - images are created manually. Later docker images should be created automatically as part of CI;no_research;;startup;open_systems_pharmacology
https://github.com/Open-Systems-Pharmacology/Fluconazole-Model;Whole-body PBPK model of fluconazole ;research;MATLAB;startup;open_systems_pharmacology
https://github.com/Open-Systems-Pharmacology/BIGS-Workshop-2021---University-of-Bonn;;no_research;;startup;open_systems_pharmacology
https://github.com/Open-Systems-Pharmacology/Finerenone-Model;Whole-body PBPK model of finerenone (KERENDIA).;research;;startup;open_systems_pharmacology
https://github.com/Open-Systems-Pharmacology/Alfentanil-Pediatrics;;research;;startup;open_systems_pharmacology
https://github.com/Open-Systems-Pharmacology/Amikacin-Pediatrics;;research;;startup;open_systems_pharmacology
https://github.com/Open-Systems-Pharmacology/Raltegravir-Pediatrics;;research;;startup;open_systems_pharmacology
https://github.com/Open-Systems-Pharmacology/Montelukast-Pediatrics;;research;;startup;open_systems_pharmacology
https://github.com/Open-Systems-Pharmacology/Sufentanil-Pediatrics;;research;;startup;open_systems_pharmacology
https://github.com/Open-Systems-Pharmacology/Vancomycin-Pediatrics;;research;;startup;open_systems_pharmacology
https://github.com/Open-Systems-Pharmacology/Fluconazole-Alfentanil-DDI;Modeling of published clinical Fluconazole-Alfentanil-DDI studies for model evaluation;research;;startup;open_systems_pharmacology
https://github.com/Open-Systems-Pharmacology/Fluconazole-Midazolam-DDI;Modeling of published clinical Fluconazole-Midazolam-DDI studies for model evaluation;research;;startup;open_systems_pharmacology
https://github.com/Open-Systems-Pharmacology/Fluconazole-Triazolam-DDI;Modeling of published clinical Fluconazole-Triazolam-DDI studies for model evaluation;research;;startup;open_systems_pharmacology
https://github.com/Open-Systems-Pharmacology/Propofol-Pediatrics;;research;;startup;open_systems_pharmacology
https://github.com/Open-Systems-Pharmacology/Propofol-Model;Whole-body pbpbk model of Propofol;research;R;startup;open_systems_pharmacology
https://github.com/Open-Systems-Pharmacology/Pediatric_Qualification_Package_UGT1A1_Ontogeny;Pediatric Qualification Package for UGT1A1 Ontogeny;research;R;startup;open_systems_pharmacology
https://github.com/Open-Systems-Pharmacology/Rifampicin-Rosuvastatin-DDI;Modeling of published clinical Rifampicin-Rosuvastatin-DDI studies for model evaluation;research;;startup;open_systems_pharmacology
https://github.com/Open-Systems-Pharmacology/Gemfibrozil-Rosuvastatin-DDI;Modeling of published clinical Gemfibrozil-Rosuvastatin-DDI studies for model evaluation;research;;startup;open_systems_pharmacology
https://github.com/Open-Systems-Pharmacology/Probenecid-Rosuvastatin-DDI;Modeling of published clinical Probenecid-Rosuvastatin-DDI studies for model evaluation;research;;startup;open_systems_pharmacology
https://github.com/Open-Systems-Pharmacology/Rosuvastatin-Model;Whole-body PBPK model of rosuvastatin (OATP1B1/OATP1B3/BCRP DDI victim drug);research;;startup;open_systems_pharmacology
https://github.com/Open-Systems-Pharmacology/Pediatric_Qualification_Package_UGT1A9_Ontogeny;Pediatric Qualification Package for UGT1A9 Ontogeny ;research;R;startup;open_systems_pharmacology
https://github.com/Open-Systems-Pharmacology/OSPSuite.BuildingBlockTemplates;List of PK-Sim building block templates available on demand for PK-Sim users;no_research;;startup;open_systems_pharmacology
https://github.com/Open-Systems-Pharmacology/OSPSuite.RUtils;Utility functions for Open Systems Pharmacology R packages;research;R;startup;open_systems_pharmacology
https://github.com/Open-Systems-Pharmacology/AGePOP-OSP-Workshop-2021;;no_research;;startup;open_systems_pharmacology
https://github.com/Open-Systems-Pharmacology/Olanzapine-Model;PBPK model of olanzapine;research;;startup;open_systems_pharmacology
https://github.com/Open-Systems-Pharmacology/Lactation-PBPK-model;;research;;startup;open_systems_pharmacology
https://github.com/Open-Systems-Pharmacology/.github;;no_research;;startup;open_systems_pharmacology
https://github.com/Open-Systems-Pharmacology/TestCases;Test cases for the new OSP features;no_research;;startup;open_systems_pharmacology
https://github.com/Open-Systems-Pharmacology/Dextromethorphan-Model;PBPK Model of Dextromethorphan and its Metabolites;research;;startup;open_systems_pharmacology
https://github.com/Open-Systems-Pharmacology/PharMetrX-Workshop-April-2022;;no_research;;startup;open_systems_pharmacology
https://github.com/Open-Systems-Pharmacology/2022_june_pbpk_page_workshop;Leveraging in vitro data for MIDD pre-PAGE 2-day workshop ;no_research;;startup;open_systems_pharmacology
https://github.com/Open-Systems-Pharmacology/Workflows;Reusable workflows (e.g. GitHub Actions) which can be used in any OSP repository;no_research;;startup;open_systems_pharmacology
https://github.com/Open-Systems-Pharmacology/Cimetidine-Carbamazepine-DDI;Modeling of published clinical Cimetidine-Carbamazepine DDI studies for model evaluation;research;;startup;open_systems_pharmacology
https://github.com/Open-Systems-Pharmacology/Carbamazepine-Midazolam-DDI;Modeling of published clinical Carbamazepine-Midazolam-DDI studies for model evaluation;research;;startup;open_systems_pharmacology
https://github.com/Open-Systems-Pharmacology/Clopidogrel-Model;Whole-body parent-metabolite PBPK model of Clopidogrel for CYP2B6, CYP2C8, CYP2C19, and CYP3A4 DDGI Predictions;research;;startup;open_systems_pharmacology
https://github.com/Open-Systems-Pharmacology/Clopidogrel-Bupropion-DDI;Modeling of published clinical Clopidogrel-Bupropion-DDI studies for model evaluation;research;;startup;open_systems_pharmacology
https://github.com/Open-Systems-Pharmacology/Clopidogrel-Montelukast-DDI;Modeling of published clinical Clopidogrel-Montelukast-DDI studies for model evaluation;research;;startup;open_systems_pharmacology
https://github.com/Open-Systems-Pharmacology/Clopidogrel-Pioglitazone-DDI;Modeling of published clinical Clopidogrel-Pioglitazone-DDI studies for model evaluation;research;;startup;open_systems_pharmacology
https://github.com/Open-Systems-Pharmacology/Clopidogrel-Repaglinide-DDI;Modeling of published clinical Clopidogrel-Repaglinide-DDI studies for model evaluation;research;;startup;open_systems_pharmacology
https://github.com/Open-Systems-Pharmacology/Omeprazole-Clopidogrel-DDI;Modeling of published clinical Omeprazole-Clopidogrel-DDI studies for model evaluation;research;;startup;open_systems_pharmacology
https://github.com/Open-Systems-Pharmacology/Rifampicin-Clopidogrel-DDI;Modeling of published clinical Rifampicin-Clopidogrel-DDI studies for model evaluation;research;;startup;open_systems_pharmacology
https://github.com/Open-Systems-Pharmacology/Creatinine-Model;;research;;startup;open_systems_pharmacology
https://github.com/Open-Systems-Pharmacology/N1-Methylnicotinamide-NMN-Model;;research;;startup;open_systems_pharmacology
https://github.com/Open-Systems-Pharmacology/Creatinine-drug-biomaker-interactions;;research;;startup;open_systems_pharmacology
https://github.com/Open-Systems-Pharmacology/N1-Methylnicotinamide-NMN-drug-biomaker-interactions;;research;;startup;open_systems_pharmacology
https://github.com/Open-Systems-Pharmacology/Sildenafil-Model;;research;MATLAB;startup;open_systems_pharmacology
https://github.com/Open-Systems-Pharmacology/Felodipine-Model;;research;MATLAB;startup;open_systems_pharmacology
https://github.com/Open-Systems-Pharmacology/Voriconazole-Model;Whole-body PBPK model of voriconazole as CYP2C19 substrate and CYP3A4 perpetrator drug;research;;startup;open_systems_pharmacology
https://github.com/Open-Systems-Pharmacology/Birds-PBK-Model;;research;HTML;startup;open_systems_pharmacology
https://github.com/Open-Systems-Pharmacology/Thyroid-Hormones-PB-QSP-Model;Physiology-based systems pharmacology model of thyroid hormones regulation in rat and human;research;R;startup;open_systems_pharmacology
https://github.com/Open-Systems-Pharmacology/dAb2-Model;;research;R;startup;open_systems_pharmacology
https://github.com/Open-Systems-Pharmacology/Inulin-Model;;research;R;startup;open_systems_pharmacology
https://github.com/Open-Systems-Pharmacology/MEDI524-Model;;research;R;startup;open_systems_pharmacology
https://github.com/Open-Systems-Pharmacology/MEDI524YTE-Model;;research;R;startup;open_systems_pharmacology
https://github.com/Open-Systems-Pharmacology/CDA1-Model;;research;R;startup;open_systems_pharmacology
https://github.com/Open-Systems-Pharmacology/BAY794620-Model;;research;R;startup;open_systems_pharmacology
https://github.com/Open-Systems-Pharmacology/Qualification-CKD;Chronic Kidney Disease - Qualification of PK-Sim implementation;research;R;startup;open_systems_pharmacology
https://github.com/Open-Systems-Pharmacology/Tefibazumab-Model;;research;R;startup;open_systems_pharmacology
https://github.com/Open-Systems-Pharmacology/7E3-Model;;research;R;startup;open_systems_pharmacology
https://github.com/Open-Systems-Pharmacology/Erythromycin-Digoxin-DDI;;research;;startup;open_systems_pharmacology
https://github.com/Open-Systems-Pharmacology/Digoxin-Pediatrics;;research;;startup;open_systems_pharmacology
https://github.com/Open-Systems-Pharmacology/Warfarin-Model;;research;;startup;open_systems_pharmacology
https://github.com/Open-Systems-Pharmacology/Pediatric_Qualification_Package_P-gp_Ontogeny;Pediatric Qualification Package P-gp Ontogeny;research;R;startup;open_systems_pharmacology
https://github.com/Open-Systems-Pharmacology/Ketoconazole-Model;;research;;startup;open_systems_pharmacology
https://github.com/Open-Systems-Pharmacology/Ketoconazole-Midazolam-DDI;;research;;startup;open_systems_pharmacology
https://github.com/Open-Systems-Pharmacology/Ketoconazole-Alfentanil-DDI;;research;;startup;open_systems_pharmacology
https://github.com/Open-Systems-Pharmacology/Ketoconazole-Digoxin-DDI;;research;;startup;open_systems_pharmacology
https://github.com/Open-Systems-Pharmacology/Ketoconazole-Alprazolam-DDI;;research;;startup;open_systems_pharmacology
https://github.com/Open-Systems-Pharmacology/Ketoconazole-Triazolam-DDI;;research;;startup;open_systems_pharmacology
https://github.com/Open-Systems-Pharmacology/pharmetheus_pbpk_workshop;;no_research;;startup;open_systems_pharmacology
https://github.com/Open-Systems-Pharmacology/PharMetrX-Workshop-March-2023;;no_research;;startup;open_systems_pharmacology
https://github.com/Open-Systems-Pharmacology/developer-docs;;no_research;;startup;open_systems_pharmacology
https://github.com/Open-Systems-Pharmacology/Quinidine-Model;;research;;startup;open_systems_pharmacology
https://github.com/Open-Systems-Pharmacology/Quinidine-DDGI-Model;;research;;startup;open_systems_pharmacology
https://github.com/Open-Systems-Pharmacology/Tacrolimus-Model;;research;;startup;open_systems_pharmacology
https://github.com/Open-Systems-Pharmacology/Itraconazole-Tacrolimus-DDI;;research;;startup;open_systems_pharmacology
https://github.com/Open-Systems-Pharmacology/Voriconazole-Tacrolimus-DDGI;;research;;startup;open_systems_pharmacology
https://github.com/Open-Systems-Pharmacology/Rifampicin-Tacrolimus-DDI;;research;;startup;open_systems_pharmacology
