html_url;description;project;language;organisation;research_group
https://github.com/Open-Systems-Pharmacology/Suite;Open Systems Pharmacology Suite Setup ;research;Rich Text Format;startup;open_systems_pharmacology
https://github.com/Open-Systems-Pharmacology/PK-Sim;PK-Sim® is a comprehensive software tool for whole-body physiologically based pharmacokinetic modeling;research;C#;startup;open_systems_pharmacology
https://github.com/Open-Systems-Pharmacology/MoBi;MoBi® is a software tool for multiscale physiological modeling and simulation;research;C#;startup;open_systems_pharmacology
https://github.com/Open-Systems-Pharmacology/Matlab-Toolbox;Collection of Matlab® functions for the processing of PK-Sim® or MoBi® models;research;Rich Text Format;startup;open_systems_pharmacology
https://github.com/Open-Systems-Pharmacology/R-Toolbox;;research;R;startup;open_systems_pharmacology
https://github.com/Open-Systems-Pharmacology/Vision-Mission;Vision & Mission of Open Systems Pharmacology ;no_research;;startup;open_systems_pharmacology
https://github.com/Open-Systems-Pharmacology/OSPSuite.BDDHelper;Helper functions for BDD Development used in the Open Systems Pharmacology Suite;research;C#;startup;open_systems_pharmacology
https://github.com/Open-Systems-Pharmacology/Forum;Discussion forum for the Open Systems Pharmacology Project;no_research;;startup;open_systems_pharmacology
https://github.com/Open-Systems-Pharmacology/MiKTeX;MiKTeX distribution used by the Open Systems Pharmacology Suite;no_research;;startup;open_systems_pharmacology
https://github.com/Open-Systems-Pharmacology/OSPSuite.Utility;Cross-cutting concerns implementation used in the Open Systems Pharmacology Suite;research;C#;startup;open_systems_pharmacology
https://github.com/Open-Systems-Pharmacology/OSPSuite.Serializer;Xml serialization engine used in the Open Systems Pharmacology Suite;research;C#;startup;open_systems_pharmacology
https://github.com/Open-Systems-Pharmacology/OSPSuite.DataBinding;DataBinding framework for WinForms application used in the Open Systems Pharmacology Suite;research;C#;startup;open_systems_pharmacology
https://github.com/Open-Systems-Pharmacology/OSPSuite.DataBinding.DevExpress;DataBinding Framework for DevExpress components used by the Open Systems Pharmacology Suite;research;C#;startup;open_systems_pharmacology
https://github.com/Open-Systems-Pharmacology/OSPSuite.TeXReporting;LaTeX Reporting Component for the Open Systems Pharmacology Suite;research;C#;startup;open_systems_pharmacology
https://github.com/Open-Systems-Pharmacology/DCI;Data Component Interface used in the Open-Systems-Pharmacology Suite ;research;C++;startup;open_systems_pharmacology
https://github.com/Open-Systems-Pharmacology/OSPSuite.FuncParser;Function parser for numeric and logic expressions used by the Open Systems Pharmacology Suite;research;C++;startup;open_systems_pharmacology
https://github.com/Open-Systems-Pharmacology/OSPSuite.SimModel;Calculation engine for models built with PK-Sim® or MoBi®;research;C++;startup;open_systems_pharmacology
https://github.com/Open-Systems-Pharmacology/OSPSuite.SimModel.Solver.CVODES.282;ODE solver used by OSPSuite.SimModel. Based on CVODES solver version 2.8.2 (Copyright © 2002-2016, Lawrence Livermore National Security);research;C;startup;open_systems_pharmacology
https://github.com/Open-Systems-Pharmacology/OSPSuite.SimModelSolverBase;Base implementation for all solver used by OSPSuite.SimModel;research;C++;startup;open_systems_pharmacology
https://github.com/Open-Systems-Pharmacology/build-scripts;Collection of rake tasks used during build;research;Ruby;startup;open_systems_pharmacology
https://github.com/Open-Systems-Pharmacology/OSPSuite.Core;Core functionalities of the Open Systems Pharmacology Suite;research;C#;startup;open_systems_pharmacology
https://github.com/Open-Systems-Pharmacology/OSPSuite.Dimensions;List of dimensions supported by the Open Systems Pharmacology Suite;no_research;;startup;open_systems_pharmacology
https://github.com/Open-Systems-Pharmacology/OSPSuite.PKParameters;List of PK parameters supported by the Open Systems Pharmacology Suite;no_research;;startup;open_systems_pharmacology
https://github.com/Open-Systems-Pharmacology/OSPSuite.Documentation;Documentation files for the Open Systems Pharmacology Suite;no_research;;startup;open_systems_pharmacology
https://github.com/Open-Systems-Pharmacology/InstallationValidator;Installation Validation Tool for the Open Systems Pharmacology Suite;research;C#;startup;open_systems_pharmacology
https://github.com/Open-Systems-Pharmacology/Glucose-Insulin-Model;The physiologically-based whole-body model of the glucose-insulin-glucagon regulatory system;research;MATLAB;startup;open_systems_pharmacology
https://github.com/Open-Systems-Pharmacology/PAGE2017-Budapest;Training materials for the OSP workshop at PAGE 2017 Budapest;no_research;;startup;open_systems_pharmacology
https://github.com/Open-Systems-Pharmacology/ISSX-2017-Cologne;Training materials for the OSP workshop at ISSX 2017, Cologne;no_research;;startup;open_systems_pharmacology
https://github.com/Open-Systems-Pharmacology/ISOP-webinar---PK-Sim-MoBi-introduction;ISOP QSP Webinar Series: Bridging and Tackling the Gap between Empirical and Systems Pharmacology Models: Where do we stand? Part 7: PK-Sim/Mobi – Open Systems Pharmacology Suite by Jan Schlender;no_research;;startup;open_systems_pharmacology
https://github.com/Open-Systems-Pharmacology/OSP-based-publications-and-content;Publications of all kind based on the Open Systems Pharmacology Suite;no_research;;startup;open_systems_pharmacology
https://github.com/Open-Systems-Pharmacology/Example_Diclofenac;MoBi example projects for Diclofenac;no_research;;startup;open_systems_pharmacology
https://github.com/Open-Systems-Pharmacology/Example_ManualModel;MoBi example project for a model created in MoBi from scratch;no_research;;startup;open_systems_pharmacology
https://github.com/Open-Systems-Pharmacology/Example_Aciclovir;PK-Sim example project for Aciclovir;no_research;;startup;open_systems_pharmacology
https://github.com/Open-Systems-Pharmacology/Example_Caffeine;PK-Sim example project for Caffeine;no_research;;startup;open_systems_pharmacology
https://github.com/Open-Systems-Pharmacology/Example_Paracetamol;PK-Sim example project for Paracetamol;no_research;;startup;open_systems_pharmacology
https://github.com/Open-Systems-Pharmacology/Example_Theophylline;PK-Sim example project for Theophylline;no_research;;startup;open_systems_pharmacology
https://github.com/Open-Systems-Pharmacology/Reporting-Engine;(Matlab) Reporting-Engine;research;MATLAB;startup;open_systems_pharmacology
https://github.com/Open-Systems-Pharmacology/Matlab-Toolbox-Core;Collection of Matlab® core functions for the processing of PK-Sim® or MoBi® models ;research;MATLAB;startup;open_systems_pharmacology
https://github.com/Open-Systems-Pharmacology/ACoP-2017-FortLauderdale;Training materials for the OSP workshop at ACoP 2017, Fort Lauderdale;no_research;;startup;open_systems_pharmacology
https://github.com/Open-Systems-Pharmacology/OSPSuite.SimModel.Schema;Schema definition for xml model created for the OSPSuite.SimModel calculation engine ;no_research;;startup;open_systems_pharmacology
https://github.com/Open-Systems-Pharmacology/open-systems-pharmacology.github.io;Open Systems Pharmacology Website (www.open-systems-pharmacology.org);no_research;SCSS;startup;open_systems_pharmacology
https://github.com/Open-Systems-Pharmacology/Pregnancy-Models;Physiologically Based Pharmacokinetic Models for Pregnant Women;research;;startup;open_systems_pharmacology
https://github.com/Open-Systems-Pharmacology/ICRP-Extended;On going work regarding ICRP Population improvement;no_research;;startup;open_systems_pharmacology
https://github.com/Open-Systems-Pharmacology/PAGE-2018-Workshop;PK-Sim® & MoBi® (OSPS®) workshop on integrating PBPK with QSP for in-silico first-in-man PD predictions ;no_research;;startup;open_systems_pharmacology
https://github.com/Open-Systems-Pharmacology/PharMetrX-Workshop-March-2018;Training materials for the PharMetrX POSP PBPK workshop, Potsdam March 2018;no_research;;startup;open_systems_pharmacology
https://github.com/Open-Systems-Pharmacology/Exemplary-Protein-Models;Exemplary Protein PBPK Models ;research;;startup;open_systems_pharmacology
https://github.com/Open-Systems-Pharmacology/ACoP-2018-Workshop;PK-Sim® & MoBi® (OSPS®) workshop on integrating PBPK with QSP;no_research;;startup;open_systems_pharmacology
https://github.com/Open-Systems-Pharmacology/BOSTON-2018-Workshop; PK-Sim® & MoBi® workshop on integrating PBPK with QSP;no_research;;startup;open_systems_pharmacology
https://github.com/Open-Systems-Pharmacology/2-Day-BOSTON-Workshop-2018;PK-Sim® & MoBi® (OSPS®) workshop on integrating PBPK with QSP;no_research;;startup;open_systems_pharmacology
https://github.com/Open-Systems-Pharmacology/Clarithromycin-Model;Whole-body PBPK model of clarithromycin as CYP3A4 and P-gp DDI perpetrator drug ;research;MATLAB;startup;open_systems_pharmacology
https://github.com/Open-Systems-Pharmacology/Alfentanil-Model;Whole-body PBPK model of alfentanil as CYP3A4 DDI victim drug;research;MATLAB;startup;open_systems_pharmacology
https://github.com/Open-Systems-Pharmacology/Digoxin-Model;Whole-body PBPK model of digoxin as P-gp DDI victim drug;research;R;startup;open_systems_pharmacology
https://github.com/Open-Systems-Pharmacology/Itraconazole-Model;Whole-body PBPK model of itraconazole as CYP3A4 and P-gp DDI perpetrator drug;research;MATLAB;startup;open_systems_pharmacology
https://github.com/Open-Systems-Pharmacology/Midazolam-Model;Whole-body PBPK model of midazolam as CYP3A4 DDI victim drug;research;MATLAB;startup;open_systems_pharmacology
https://github.com/Open-Systems-Pharmacology/Rifampicin-Model;Whole-body PBPK model of rifampicin as CYP3A4 and P-gp DDI perpetrator drug;research;MATLAB;startup;open_systems_pharmacology
https://github.com/Open-Systems-Pharmacology/Clarithromycin-Midazolam-DDI;Modeling of published clinical Clarithromycin-Midazolam-DDI studies for model evaluation;research;;startup;open_systems_pharmacology
https://github.com/Open-Systems-Pharmacology/Itraconazole-Digoxin-DDI;Modeling of published clinical Itraconazole-Digoxin-DDI studies for model evaluation;research;;startup;open_systems_pharmacology
https://github.com/Open-Systems-Pharmacology/Itraconazole-Midazolam-DDI;Modeling of published clinical Itraconazole-Midazolam-DDI studies for model evaluation;research;;startup;open_systems_pharmacology
https://github.com/Open-Systems-Pharmacology/Rifampicin-Alfentanil-DDI;Modeling of published clinical Rifampicin-Alfentanil-DDI studies for model evaluation;research;;startup;open_systems_pharmacology
https://github.com/Open-Systems-Pharmacology/Rifampicin-Digoxin-DDI;Modeling of published clinical Rifampicin-Digoxin-DDI studies for model evaluation;research;;startup;open_systems_pharmacology
https://github.com/Open-Systems-Pharmacology/Rifampicin-Midazolam-DDI;Modeling of published clinical Rifampicin-Midazolam-DDI studies for model evaluation;research;;startup;open_systems_pharmacology
https://github.com/Open-Systems-Pharmacology/Clarithromycin-Digoxin-DDI;Modeling of published clinical Clarithromycin-Digoxin-DDI studies for model evaluation ;research;;startup;open_systems_pharmacology
https://github.com/Open-Systems-Pharmacology/Hormonal-Contraceptive-Agents-Datasets; Concentration data from studies performed during proprietary drug development  programs by Bayer;research;;startup;open_systems_pharmacology
https://github.com/Open-Systems-Pharmacology/docs;Open Systems Pharmacology  - Live Documentation;no_research;HTML;startup;open_systems_pharmacology
https://github.com/Open-Systems-Pharmacology/Protein-Abundance-Database;WIP: Protein Abundance Database;no_research;;startup;open_systems_pharmacology
https://github.com/Open-Systems-Pharmacology/SGLT2i-hyperfiltration-model;A Quantitative Systems Pharmacology kidney model of diabetes associated renal hyperfiltration and the effects of SGLT inhibitors.;research;R;startup;open_systems_pharmacology
https://github.com/Open-Systems-Pharmacology/QualificationPlan;Creation and processing of a qualification plan;no_research;;startup;open_systems_pharmacology
https://github.com/Open-Systems-Pharmacology/Gene-Expression-Databases;;research;R;startup;open_systems_pharmacology
https://github.com/Open-Systems-Pharmacology/BERLIN-2019-WORKSHOP;[FULLY BOOKED] SGS Exprimo and the FU Berlin will run a two-days hands-on PK-Sim® & MoBi® workshop on introducing PBPK for human dose projection and drug-drug interaction (DDI) prediction on 21st-22nd Feb 2019 at the Institute of Pharmacy, FU-Berlin, Germany.;no_research;;startup;open_systems_pharmacology
https://github.com/Open-Systems-Pharmacology/2-Day-WASHINGTON-Workshop-2019;;no_research;;startup;open_systems_pharmacology
https://github.com/Open-Systems-Pharmacology/OSPSuite.SimModel.Solver.CVODES;ODE solver used by OSPSuite.SimModel. Based on CVODES solver (Copyright © 2002-2018, Lawrence Livermore National Security);research;C;startup;open_systems_pharmacology
https://github.com/Open-Systems-Pharmacology/PAGE-2019-PB-QSP-Workshop;PK-Sim® & MoBi® (OSP Suite) workshop on PBPK-basd QSP;no_research;;startup;open_systems_pharmacology
https://github.com/Open-Systems-Pharmacology/PAGE-2019-PBPK-Workshop;PK-Sim® & MoBi® (OSP Suite) workshop on PBPK;no_research;;startup;open_systems_pharmacology
https://github.com/Open-Systems-Pharmacology/2-Day-Orlando-Workshop-2019;PK-Sim® & MoBi® workshop on PBPK and PBPK-based QSP;no_research;;startup;open_systems_pharmacology
https://github.com/Open-Systems-Pharmacology/QualificationRunner;Qualification runner in charge of managing a qualification workflow;research;C#;startup;open_systems_pharmacology
https://github.com/Open-Systems-Pharmacology/Fluvoxamine-Model;Whole-body PBPK model of fluvoxamine as CYP1A2 and CYP3A4 DDI perpetrator drug;research;MATLAB;startup;open_systems_pharmacology
https://github.com/Open-Systems-Pharmacology/Fluvoxamine-Theophylline-DDI;Modeling of published clinical Fluvoxamine-Theophylline-DDI studies for model evaluation;research;;startup;open_systems_pharmacology
https://github.com/Open-Systems-Pharmacology/Rifampicin-Theophylline-DDI;Modeling of published clinical Rifampicin-Theophylline-DDI studies for model evaluation;research;;startup;open_systems_pharmacology
https://github.com/Open-Systems-Pharmacology/Fluvoxamine-Caffeine-DDI;Modeling of published clinical Fluvoxamine-Caffeine-DDI studies for model evaluation;research;;startup;open_systems_pharmacology
https://github.com/Open-Systems-Pharmacology/Fluvoxamine-Midazolam-DDI;Modeling of published clinical Fluvoxamine-Midazolam-DDI studies for model evaluation;research;;startup;open_systems_pharmacology
https://github.com/Open-Systems-Pharmacology/Theophylline-Model;Whole-body PBPK model of theophylline as CYP1A2 DDI victim drug;research;;startup;open_systems_pharmacology
https://github.com/Open-Systems-Pharmacology/Triazolam-Model;Whole-body PBPK model of triazolam;research;MATLAB;startup;open_systems_pharmacology
https://github.com/Open-Systems-Pharmacology/Alprazolam-Model;Whole-body PBPK model of alprazolam;research;MATLAB;startup;open_systems_pharmacology
https://github.com/Open-Systems-Pharmacology/PharMetrX-Workshop-March-2019;Training materials for the PharMetrX POSP PBPK workshop, Potsdam March 2019;no_research;;startup;open_systems_pharmacology
https://github.com/Open-Systems-Pharmacology/IFN-alpha;A multiscale QSP model of IFN-alpha induced activation of the JAK/STAT pathway in human liver cells (Kalra et al., 2019);research;;startup;open_systems_pharmacology
https://github.com/Open-Systems-Pharmacology/OSPSuite-R;R package for the OSPSuite;research;R;startup;open_systems_pharmacology
https://github.com/Open-Systems-Pharmacology/markdown-joiner;Reporting tool allowing different markdown files to be exported in a cohesive structure (html, md, pdf);research;JavaScript;startup;open_systems_pharmacology
https://github.com/Open-Systems-Pharmacology/Qualification-text-modules;;research;;startup;open_systems_pharmacology
https://github.com/Open-Systems-Pharmacology/Skin-permeation-model;Implementation of Dancik et al (2013) skin permeation model in MoBi;research;;startup;open_systems_pharmacology
https://github.com/Open-Systems-Pharmacology/Qualification-DDI-CYP3A4;Qualification of OSP platform for CYP3A4-mediated DDI;research;MATLAB;startup;open_systems_pharmacology
https://github.com/Open-Systems-Pharmacology/Gemfibrozil-Model;Whole-body PBPK model of gemfibrozil as CYP2C8 and OATP1B1 DDI perpetrator drug;research;;startup;open_systems_pharmacology
https://github.com/Open-Systems-Pharmacology/Repaglinide-Model;Whole-body PBPK model of repaglinide as CYP2C8, CYP3A4, OATP1B1 and OATP1B3 DDI victim drug;research;;startup;open_systems_pharmacology
https://github.com/Open-Systems-Pharmacology/Pioglitazone-Model;Whole-body PBPK model of pioglitazone as CYP2C8 DDI victim drug;research;;startup;open_systems_pharmacology
https://github.com/Open-Systems-Pharmacology/Gemfibrozil-Repaglinide-DDI;Modeling of published clinical gemfibrozil-repaglinide-DDI studies for model evaluation;research;;startup;open_systems_pharmacology
https://github.com/Open-Systems-Pharmacology/Gemfibrozil-Pioglitazone-DDI;Modeling of published clinical gemfibrozil-pioglitazone-DDI studies for model evaluation;research;;startup;open_systems_pharmacology
https://github.com/Open-Systems-Pharmacology/Itraconazole-Repaglinide-DDI;Modeling of published clinical itraconazole-repaglinide-DDI studies for model evaluation;research;;startup;open_systems_pharmacology
https://github.com/Open-Systems-Pharmacology/Itraconazole-Pioglitazone-DDI;Modeling of published clinical itraconazole-pioglitazone-DDI studies for model evaluation;research;;startup;open_systems_pharmacology
https://github.com/Open-Systems-Pharmacology/Gemfibrozil-Itraconazole-Repaglinide-DDI;Modeling of published clinical gemfibrozil-itraconazole-repaglinide-DDI studies for model evaluation;research;;startup;open_systems_pharmacology
https://github.com/Open-Systems-Pharmacology/Gemfibrozil-Itraconazole-Pioglitazone-DDI;Modeling of published clinical gemfibrozil-itraconazole-pioglitazone-DDI studies for model evaluation;research;;startup;open_systems_pharmacology
https://github.com/Open-Systems-Pharmacology/Rifampicin-Repaglinide-DDI;Modeling of published clinical rifampicin-repaglinide-DDI studies for model evaluation;research;;startup;open_systems_pharmacology
https://github.com/Open-Systems-Pharmacology/Rifampicin-Pioglitazone-DDI;Modeling of published clinical rifampicin-pioglitazone-DDI studies for model evaluation;research;;startup;open_systems_pharmacology
https://github.com/Open-Systems-Pharmacology/Clarithromycin-Repaglinide-DDI;Modeling of published clinical clarithromycin-repaglinide-DDI studies for model evaluation;research;;startup;open_systems_pharmacology
https://github.com/Open-Systems-Pharmacology/Amikacin-Model;Whole-body PBPK model of Amikacin;research;MATLAB;startup;open_systems_pharmacology
https://github.com/Open-Systems-Pharmacology/Vancomycin-Model;Whole-body PBPK model of Vancomycin ;research;MATLAB;startup;open_systems_pharmacology
https://github.com/Open-Systems-Pharmacology/Pregabalin-Model;Whole-body PBPK model of Pregabalin;research;;startup;open_systems_pharmacology
https://github.com/Open-Systems-Pharmacology/Sufentanil-Model;Whole-body PBPK model of Sufentanil;research;MATLAB;startup;open_systems_pharmacology
https://github.com/Open-Systems-Pharmacology/ACoP-10-PBPK-Workshop-2019;PBPK Workshop at ACoP 10 2019;no_research;;startup;open_systems_pharmacology
https://github.com/Open-Systems-Pharmacology/ACoP-10-Antibody-PBPKPD-Workshop-2019;Workshop on PBPK/PD of ADCs in Tumor Treatment;no_research;;startup;open_systems_pharmacology
https://github.com/Open-Systems-Pharmacology/Montelukast-Model;Whole-body PBPK model of montelukast;research;MATLAB;startup;open_systems_pharmacology
https://github.com/Open-Systems-Pharmacology/Paclitaxel-Model;Whole-body PBPK model of paclitaxel;research;;startup;open_systems_pharmacology
https://github.com/Open-Systems-Pharmacology/Pediatric_Qualification_Package_GFR_Ontogeny;Pediatric Qualification Package for GFR Ontogeny ;research;MATLAB;startup;open_systems_pharmacology
https://github.com/Open-Systems-Pharmacology/Pediatric_Qualification_Package_CYP3A4_Ontogeny;Pediatric Qualification Package for CYP3A4 Ontogeny ;research;MATLAB;startup;open_systems_pharmacology
https://github.com/Open-Systems-Pharmacology/Pediatric_Qualification_Package_CYP2C8_Ontogeny;Pediatric Qualification Package for CYP2C8 Ontogeny ;research;MATLAB;startup;open_systems_pharmacology
https://github.com/Open-Systems-Pharmacology/TLF-Library;TLF Library implementation in R;research;R;startup;open_systems_pharmacology
https://github.com/Open-Systems-Pharmacology/Boston-PBPKPD-Workshop-Sept-2019;PBPK/PD Workshop for Small Molecules and Antibodies with PK-Sim and MoBi;no_research;;startup;open_systems_pharmacology
https://github.com/Open-Systems-Pharmacology/OSMOSES;Open-Source MOdeling framework for automated quality control and management of complex life Science systEms modelS (OSMOSES);no_research;;startup;open_systems_pharmacology
https://github.com/Open-Systems-Pharmacology/Dapagliflozin-Model;Whole-body PBPK model of dapagliflozin;research;MATLAB;startup;open_systems_pharmacology
https://github.com/Open-Systems-Pharmacology/Evaluation-plan-template;;research;R;startup;open_systems_pharmacology
https://github.com/Open-Systems-Pharmacology/Raltegravir-Model;Whole-body PBPK model of Raltegravir;research;MATLAB;startup;open_systems_pharmacology
https://github.com/Open-Systems-Pharmacology/Atazanavir-Raltegravir-DDI;Modeling of published clinical atazanavir-raltegravir-DDI studies ;research;;startup;open_systems_pharmacology
https://github.com/Open-Systems-Pharmacology/Atazanavir-Model;Whole-body PBPK model of atazanavir ;research;MATLAB;startup;open_systems_pharmacology
https://github.com/Open-Systems-Pharmacology/Mefenamic_acid-Dapagliflozin-DDI;Modeling of published clinical mefenamic acid-dapagliflozin-DDI studies;research;;startup;open_systems_pharmacology
https://github.com/Open-Systems-Pharmacology/OSPSuite.ReportingEngine;R implementation of the reporting engine ;research;R;startup;open_systems_pharmacology
https://github.com/Open-Systems-Pharmacology/Ondansetron-Model;;no_research;;startup;open_systems_pharmacology
https://github.com/Open-Systems-Pharmacology/Oxycodone-Model;;research;;startup;open_systems_pharmacology
https://github.com/Open-Systems-Pharmacology/ASCPT-Satelite-OSPS-Workshops;ASCPT2020 satellite workshops: PK-Sim® & MoBi® hands-on training for PBPK and PBPK-based QSP at University of Houston, College of Pharmacy (www.esqlabs.com/news-events);no_research;;startup;open_systems_pharmacology
https://github.com/Open-Systems-Pharmacology/rClr;R package for accessing .NET;research;C#;startup;open_systems_pharmacology
https://github.com/Open-Systems-Pharmacology/QSPC-Satellite-OSPS-Workshops;QSPC2020 satellite workshops: PK-Sim® & MoBi® hands-on training for PBPK and PBPK-based QSP in Leiden, Netherlands (April 21st and 25th) (www.esqlabs.com/news-events) ;no_research;;startup;open_systems_pharmacology
https://github.com/Open-Systems-Pharmacology/OSPS-Workshop-Afrika-Cape-Town-2020;PK-Sim goes Africa! Open source PBPK modelling with the OSPSuite (PK-Sim® & MoBi®) for MIDD at WCOP2020;no_research;;startup;open_systems_pharmacology
https://github.com/Open-Systems-Pharmacology/Qualification-DDI-UGT;Qualification of UGT-mediated drug-drug interactions;research;MATLAB;startup;open_systems_pharmacology
https://github.com/Open-Systems-Pharmacology/Mefenamic-acid-Model;Whole-body PBPK model of mefenamic acid;research;MATLAB;startup;open_systems_pharmacology
https://github.com/Open-Systems-Pharmacology/Database-for-observed-data;Database for published pharmacokinetic data;research;R;startup;open_systems_pharmacology
https://github.com/Open-Systems-Pharmacology/OSPS-PBPK-and-QSP-Workshop-at-PAGE-2020;PAGE 2020 satellite workshops: PK-Sim® & MoBi® hands-on training for PBPK and PBPK-based QSP (www.esqlabs.com/news-events) ;no_research;;startup;open_systems_pharmacology
https://github.com/Open-Systems-Pharmacology/Idarucizumab-Model;;research;;startup;open_systems_pharmacology
https://github.com/Open-Systems-Pharmacology/Dabigatran-Reversal-Model;;research;;startup;open_systems_pharmacology
https://github.com/Open-Systems-Pharmacology/tracelib;package to capture and store workflow traceability metadata;research;R;startup;open_systems_pharmacology
https://github.com/Open-Systems-Pharmacology/test-appveyor;Repository for testing purposes only;no_research;Ruby;startup;open_systems_pharmacology
https://github.com/Open-Systems-Pharmacology/OSPSuite.CentOS;;no_research;;startup;open_systems_pharmacology
https://github.com/Open-Systems-Pharmacology/Itraconazole-Alprazolam-DDI;Modeling of published clinical Itraconazole-Alprazolam-DDI studies for model evaluation ;research;;startup;open_systems_pharmacology
https://github.com/Open-Systems-Pharmacology/Itraconazole-Triazolam-DDI;Modeling of published clinical Itraconazole-Triazolam-DDI studies for model evaluation ;research;;startup;open_systems_pharmacology
https://github.com/Open-Systems-Pharmacology/Erythromycin-Midazolam-DDI;;research;;startup;open_systems_pharmacology
https://github.com/Open-Systems-Pharmacology/Erythromycin-Alprazolam-DDI;;research;;startup;open_systems_pharmacology
https://github.com/Open-Systems-Pharmacology/Erythromycin-Alfentanil-DDI;;research;;startup;open_systems_pharmacology
